{
  "schemaVersion": "1.0.0",
  "provider": "elevenlabs",
  "language": "de",
  "resolvedAt": "2026-09-17T16:48:16Z",
  "standalone": {
    "voiceId": "tnSpp4vdxKPjI9w0GnoV",
    "voiceName": "Hope - upbeat and clear",
    "strategy": "preference_name",
    "matchScore": null,
    "providerMetadata": {
      "category": "professional",
      "labels": {
        "use_case": "social_media",
        "accent": "american",
        "descriptive": "upbeat",
        "language": "en",
        "gender": "female",
        "age": "young"
      },
      "verifiedLanguages": [
        {
          "language": "en",
          "model_id": "eleven_turbo_v2",
          "accent": "american",
          "locale": "en-US",
          "preview_url": "https://storage.googleapis.com/eleven-public-prod/custom/voices/tnSpp4vdxKPjI9w0GnoV/LiIyxRT1qFJ1QJPr8sWl.mp3"
        },
        {
          "language": "en",
          "model_id": "eleven_turbo_v2_5",
          "accent": "american",
          "locale": "en-US",
          "preview_url": "https://storage.googleapis.com/eleven-public-prod/custom/voices/tnSpp4vdxKPjI9w0GnoV/LiIyxRT1qFJ1QJPr8sWl.mp3"
        },
        {
          "language": "en",
          "model_id": "eleven_multilingual_sts_v2",
          "accent": "american",
          "locale": "en-US",
          "preview_url": "https://storage.googleapis.com/eleven-public-prod/custom/voices/tnSpp4vdxKPjI9w0GnoV/LiIyxRT1qFJ1QJPr8sWl.mp3"
        },
        {
          "language": "en",
          "model_id": "eleven_multilingual_v2",
          "accent": "american",
          "locale": "en-US",
          "preview_url": "https://storage.googleapis.com/eleven-public-prod/custom/voices/tnSpp4vdxKPjI9w0GnoV/LiIyxRT1qFJ1QJPr8sWl.mp3"
        },
        {
          "language": "pt",
          "model_id": "eleven_multilingual_v2",
          "accent": "brazilian",
          "locale": "pt-BR",
          "preview_url": "https://storage.googleapis.com/eleven-public-prod/database/user/sD92HnMHS9WZLXKNTKxmnC8XmJ32/voices/tnSpp4vdxKPjI9w0GnoV/5bb016a9-5180-42f6-a7d8-3aa816948a76.mp3"
        },
        {
          "language": "ru",
          "model_id": "eleven_multilingual_v2",
          "accent": "standard",
          "locale": "ru-RU",
          "preview_url": "https://storage.googleapis.com/eleven-public-prod/database/user/sD92HnMHS9WZLXKNTKxmnC8XmJ32/voices/tnSpp4vdxKPjI9w0GnoV/84d299f3-6126-4890-9ed9-0764f8139aad.mp3"
        },
        {
          "language": "cs",
          "model_id": "eleven_multilingual_v2",
          "accent": "standard",
          "locale": "cs-CZ",
          "preview_url": "https://storage.googleapis.com/eleven-public-prod/database/user/sD92HnMHS9WZLXKNTKxmnC8XmJ32/voices/tnSpp4vdxKPjI9w0GnoV/fe859c48-78be-4765-abb7-03ec5b7622d7.mp3"
        },
        {
          "language": "hr",
          "model_id": "eleven_multilingual_v2",
          "accent": "standard",
          "locale": "hr-HR",
          "preview_url": "https://storage.googleapis.com/eleven-public-prod/database/user/sD92HnMHS9WZLXKNTKxmnC8XmJ32/voices/tnSpp4vdxKPjI9w0GnoV/c2b7b17f-f072-46a0-a8b0-b2eae3ec40cc.mp3"
        },
        {
          "language": "bg",
          "model_id": "eleven_multilingual_v2",
          "accent": "standard",
          "locale": "bg-BG",
          "preview_url": "https://storage.googleapis.com/eleven-public-prod/database/user/sD92HnMHS9WZLXKNTKxmnC8XmJ32/voices/tnSpp4vdxKPjI9w0GnoV/15f62265-ede4-4335-8d32-1bc58e871580.mp3"
        },
        {
          "language": "fr",
          "model_id": "eleven_multilingual_v2",
          "accent": "standard",
          "locale": "fr-FR",
          "preview_url": "https://storage.googleapis.com/eleven-public-prod/database/user/sD92HnMHS9WZLXKNTKxmnC8XmJ32/voices/tnSpp4vdxKPjI9w0GnoV/e4bdf27e-e3b0-41aa-8ac7-9a50ff5ad6d8.mp3"
        },
        {
          "language": "fil",
          "model_id": "eleven_turbo_v2_5",
          "accent": "standard",
          "locale": "fil-PH",
          "preview_url": "https://storage.googleapis.com/eleven-public-prod/database/user/sD92HnMHS9WZLXKNTKxmnC8XmJ32/voices/tnSpp4vdxKPjI9w0GnoV/1e0af21d-5edb-4c97-bec7-cee08d5f555d.mp3"
        },
        {
          "language": "tr",
          "model_id": "eleven_turbo_v2_5",
          "accent": "standard",
          "locale": "tr-TR",
          "preview_url": "https://storage.googleapis.com/eleven-public-prod/database/user/sD92HnMHS9WZLXKNTKxmnC8XmJ32/voices/tnSpp4vdxKPjI9w0GnoV/a8addd5c-9b04-4fe5-bc22-16ca54584e14.mp3"
        },
        {
          "language": "hi",
          "model_id": "eleven_turbo_v2_5",
          "accent": "central",
          "locale": null,
          "preview_url": "https://storage.googleapis.com/eleven-public-prod/database/user/sD92HnMHS9WZLXKNTKxmnC8XmJ32/voices/tnSpp4vdxKPjI9w0GnoV/4698814c-7d1b-4572-b765-553e2153766a.mp3"
        },
        {
          "language": "hu",
          "model_id": "eleven_turbo_v2_5",
          "accent": "standard",
          "locale": "hu-HU",
          "preview_url": "https://storage.googleapis.com/eleven-public-prod/database/user/sD92HnMHS9WZLXKNTKxmnC8XmJ32/voices/tnSpp4vdxKPjI9w0GnoV/f354ccfe-7f0a-4a11-a67c-8ee906a9d973.mp3"
        },
        {
          "language": "ro",
          "model_id": "eleven_turbo_v2_5",
          "accent": "standard",
          "locale": "ro-RO",
          "preview_url": "https://storage.googleapis.com/eleven-public-prod/database/user/sD92HnMHS9WZLXKNTKxmnC8XmJ32/voices/tnSpp4vdxKPjI9w0GnoV/274584ee-689e-41b8-b492-e36fbe817d32.mp3"
        },
        {
          "language": "ru",
          "model_id": "eleven_turbo_v2_5",
          "accent": "standard",
          "locale": "ru-RU",
          "preview_url": "https://storage.googleapis.com/eleven-public-prod/database/user/sD92HnMHS9WZLXKNTKxmnC8XmJ32/voices/tnSpp4vdxKPjI9w0GnoV/a0087f30-4401-4846-b82e-07d7d73277ce.mp3"
        },
        {
          "language": "pt",
          "model_id": "eleven_turbo_v2_5",
          "accent": "standard",
          "locale": "pt-BR",
          "preview_url": "https://storage.googleapis.com/eleven-public-prod/database/user/sD92HnMHS9WZLXKNTKxmnC8XmJ32/voices/tnSpp4vdxKPjI9w0GnoV/0eef787c-d480-485c-907e-632b30120e56.mp3"
        },
        {
          "language": "el",
          "model_id": "eleven_turbo_v2_5",
          "accent": "southern",
          "locale": null,
          "preview_url": "https://storage.googleapis.com/eleven-public-prod/database/user/sD92HnMHS9WZLXKNTKxmnC8XmJ32/voices/tnSpp4vdxKPjI9w0GnoV/83d8d08c-0fc8-471b-b6de-282c205e34c0.mp3"
        },
        {
          "language": "sk",
          "model_id": "eleven_turbo_v2_5",
          "accent": "standard",
          "locale": "sk-SK",
          "preview_url": "https://storage.googleapis.com/eleven-public-prod/database/user/sD92HnMHS9WZLXKNTKxmnC8XmJ32/voices/tnSpp4vdxKPjI9w0GnoV/8a5a70c4-556b-46a5-bb5b-ab0a826011c8.mp3"
        },
        {
          "language": "ta",
          "model_id": "eleven_turbo_v2_5",
          "accent": "standard",
          "locale": "ta-IN",
          "preview_url": "https://storage.googleapis.com/eleven-public-prod/database/user/sD92HnMHS9WZLXKNTKxmnC8XmJ32/voices/tnSpp4vdxKPjI9w0GnoV/30ee6295-a1e1-4e22-84af-7dc505bb18f6.mp3"
        },
        {
          "language": "fr",
          "model_id": "eleven_turbo_v2_5",
          "accent": "standard",
          "locale": "fr-FR",
          "preview_url": "https://storage.googleapis.com/eleven-public-prod/database/user/sD92HnMHS9WZLXKNTKxmnC8XmJ32/voices/tnSpp4vdxKPjI9w0GnoV/09317786-36dd-437b-979c-9873882d442b.mp3"
        },
        {
          "language": "hr",
          "model_id": "eleven_turbo_v2_5",
          "accent": "standard",
          "locale": "hr-HR",
          "preview_url": "https://storage.googleapis.com/eleven-public-prod/database/user/sD92HnMHS9WZLXKNTKxmnC8XmJ32/voices/tnSpp4vdxKPjI9w0GnoV/3e724736-96b9-42b6-80a1-ef81f160a5ec.mp3"
        }
      ],
      "recordingQuality": null
    }
  },
  "characters": {
    "char-de-iris": {
      "voiceId": "KXxZd16DiBqt82nbarJx",
      "voiceName": "Lucy Fennek -  Friendly and Open",
      "strategy": "explicit",
      "matchScore": null,
      "providerMetadata": {
        "category": "professional",
        "labels": {
          "use_case": "conversational",
          "accent": "standard",
          "language": "de",
          "descriptive": "confident",
          "gender": "female",
          "age": "young"
        },
        "verifiedLanguages": [
          {
            "language": "de",
            "model_id": "eleven_turbo_v2_5",
            "accent": "standard",
            "locale": "de-DE",
            "preview_url": "https://storage.googleapis.com/eleven-public-prod/database/workspace/631bf5a20c2d45ffacc1311eb5dec41f/voices/KXxZd16DiBqt82nbarJx/7ziMjJhvVwsqj0oNMemu.mp3"
          },
          {
            "language": "de",
            "model_id": "eleven_v2_5_flash",
            "accent": "standard",
            "locale": "de-DE",
            "preview_url": "https://storage.googleapis.com/eleven-public-prod/database/workspace/631bf5a20c2d45ffacc1311eb5dec41f/voices/KXxZd16DiBqt82nbarJx/7ziMjJhvVwsqj0oNMemu.mp3"
          },
          {
            "language": "de",
            "model_id": "eleven_flash_v2_5",
            "accent": "standard",
            "locale": "de-DE",
            "preview_url": "https://storage.googleapis.com/eleven-public-prod/database/workspace/631bf5a20c2d45ffacc1311eb5dec41f/voices/KXxZd16DiBqt82nbarJx/7ziMjJhvVwsqj0oNMemu.mp3"
          },
          {
            "language": "de",
            "model_id": "eleven_multilingual_v2",
            "accent": "standard",
            "locale": "de-DE",
            "preview_url": "https://storage.googleapis.com/eleven-public-prod/database/workspace/631bf5a20c2d45ffacc1311eb5dec41f/voices/KXxZd16DiBqt82nbarJx/7ziMjJhvVwsqj0oNMemu.mp3"
          },
          {
            "language": "de",
            "model_id": "eleven_multilingual_sts_v2",